{
  "name": "Easy Vegan Strawberry Sauce",
  "description": "A simple and delicious vegan strawberry sauce made with frozen organic strawberries, perfect for topping desserts, breakfast, and more.",
  "prepTime": 5,
  "cookTime": 15,
  "servings": 4,
  "ingredients": {
    "wet": [
      {
        "name": "water",
        "amount": 0.25,
        "units": "cup"
      },
      {
        "name": "lemon juice",
        "amount": 1,
        "units": "tablespoon"
      },
      {
        "name": "vanilla extract",
        "amount": 0.5,
        "units": "teaspoon"
      }
    ],
    "dry": [
      {
        "name": "organic frozen strawberries",
        "amount": 16,
        "units": "oz"
      },
      {
        "name": "granulated sugar",
        "amount": 0.25,
        "units": "cup",
        "notes": "You can adjust to your desired sweetness."
      },
      {
        "name": "cornstarch",
        "amount": 1,
        "units": "tablespoon"
      }
    ]
  },
  "instructions": [
    "In a small bowl, whisk together the cornstarch and water to create a slurry. Set aside.",
    "In a medium saucepan, combine the frozen strawberries and sugar. Cook over medium heat, stirring occasionally, until the strawberries start to break down and release their juices (about 5-7 minutes).",
    "Stir in the lemon juice and vanilla extract.",
    "Pour the cornstarch slurry into the saucepan and whisk to combine.",
    "Bring the sauce to a simmer and cook for another 2-3 minutes, stirring constantly, until the sauce has thickened.",
    "Remove from heat and let it cool slightly. The sauce will continue to thicken as it cools.",
    "For a smoother sauce, you can use an immersion blender or transfer it to a regular blender."
  ],
  "notes": "This sauce can be stored in an airtight container in the refrigerator for up to a week. It's excellent on pancakes, waffles, ice cream, or yogurt.",
  "tags": [
    "vegan",
    "strawberry",
    "sauce",
    "dessert",
    "topping",
    "easy",
    "frozen fruit"
  ],
  "stock_image_url": "https://loremflickr.com/800/600/Easy,Vegan,Strawberry,Sauce/all",
  "user_id": "anonymous",
  "ai_metadata": {
    "model": "unknown",
    "timestamp": "2025-12-04T16:14:55.223309",
    "prompt": "unknown",
    "images_working": true,
    "image_generation": {
      "model": "imagen-4.0-generate-001",
      "user_id": "adamschoen3@tasteslikegood.org",
      "user_display_name": "Adam Schoen",
      "is_authenticated": true,
      "session_id": "session_910683665e204802900f7ce103167dbe",
      "prompt": "A delicious, high-quality food photography shot of Easy Vegan Strawberry Sauce. Professional lighting, appetizing.",
      "timestamp": "2026-01-28T14:29:59.742649",
      "success": true,
      "image_path": "static/images/ai_vegan_strawberry_sauce.png"
    }
  },
  "ai_image_url": "/static/images/ai_vegan_strawberry_sauce.png"
}